各方面都不错，性价比也比较高。就是有些房间内设施要打电话才送来，例如电吹风，地图等。我住的是B区，好像要档次低一些，但还可以，只是我住的房间刚好有半堵墙挡住了风景，但是我同事住的对着湖面很漂亮。健身区正在装修，所以没能去游泳和运动很遗憾。大堂满高档的。房间内饰比较朴素。早餐还行。区位也还行，虽然离漂亮的团还有点距离。,1
这次入住的宜兴宾馆性价比还是比较高的，房间很大，房内布置也比较温馨。早餐品种太少了，服务员态度比较好。,1
"我是10月20日一家人入住的,北京五日游,从门童,柜台接待,餐厅服务,卫生,都比较温馨,热情,礼貌,给人一种宾至如归之感.入住,结帐都很及时,速度很快.到北京各景点交通很方便.周围的景点步行10分钟到达的有梅",1
如家，一贯的风格，房间也是这样，怎么说，如家的价格还是比较实在，在上海住店，能干净、价格优惠就行了。。。,1
离机场很近，房间里的床很大，里面还有一面镜子,1
还行吧，不算失望，离地铁2号线要走500M左右，但在中环旁边，自己开车去比较方便。,1
"在携程上订了一天，实际入住两天，酒店照携程价加收了一天房费，并为我免费升级了商务房。中间问酒店前台借过指甲剪，他们说没有，建议这类的小物品还是应该提供服务方便客人。吃过一顿自助早餐，品种还算可以，就是没有牛奶，只有豆浆和咖啡。总体感觉还算可以，酒店也比较新比较干净，就是隔音比较差，经常很吵，酒店出门就有地铁和公交线，有公交直达上海动物园呵呵。还有酒店延迟退房时间没有商量余地，这个不好玩。宾馆反馈2008年5月20日：感谢您对我们酒店的评价,更加感谢您对我们提的建议。在我们如家酒店的服务规范中，指甲剪之类的租借物品前台是应该免费提供给客人方便的。对这次未能向您提供服务，给您所造成的不便，我们诚恳致歉，请您原谅！以后我们酒店会加强对此类细节的关注，不再让您失望！自助早餐每天的品种是不一样的，一般是Ａ．Ｂ．Ｃ三套互换的，饮料中牛奶、豆浆、咖啡、红茶和橙汁等几种饮料也是互换的，今后夏天我们还会增加一些冰冻冷饮。您假如需要牛奶，可以向我们的服务生提出，她们会很乐意为您服务的。，欢迎您下次光临我们如家快捷北虹路店，我们一定会让您感觉到我们一天天的进步，也希望您给我们这样的机会证明给您看！",1
很不错的酒店。虽然离地铁站有一定距离，可是还是挺方便的。房间的床很大很舒服。但是相对的，别的空间就缩小了。。。不过我还是很喜欢那张床。。。早上服务员的声音有些响希望可以改进下,1
超赞！虽然窗正对中环，但一点也不觉得吵。房间很干净、整齐，给人很舒服的感觉，服务也很好，价格也不贵，非常满意！,1
7月25日到家人到泰山玩，通过携程订的华侨大厦的房间（说是搞活动，花280升级到360的房间，但是实际我们也不知道280和360的房间到底是怎样的）。对华侨大厦的评价和以前很很多网友的评价一样：服务很热情，但是设施太陈旧（在携程网上看酒店的反馈，说是有新装修的房间，但是订房的时候携程的工作人员不知道我们订的房间是否是新装修的，这点希望携程以后把工作做仔细一些）。入住华侨大厦从门童、前台带房间服务人都态度很好，很热情，对客人的要求反应很快（我因为带了孩子，要求多送一套洗漱用品到房间，刚放下电话没多久服务员就送来了），对一些我们询问的怎么去泰山玩，附近有什么好吃的等问题都很耐心的回答。房间有欢迎果盘，而且分量不小，很实在，呵呵。但是华侨大厦的设施确实太陈旧了，很多地方的墙纸已经脱落，房间的浴室比较小，而且没有独立的淋浴间，感觉老人和小孩使用时比较不方便。但是良好的服务还是可以弥补这些不足的，而且价钱也不贵，感觉还可以接受。,1
大堂不错，有四星的样子，房间的设施一般，感觉有点旧，卫生间细节不错，各种配套东西都不错，感觉还可以，有机会再去泰山还要入住。,1
"装修较旧,特别是地毯的材质颜色显得较脏,与四星的评级很不相称,门童很热情,赞一个",1
住过好多次这家酒店了，上次来到前台，服务员能准确的报出我的名字，感觉很亲切。四星级就是不一样。而且当天服务员还给我安排了一间商务单间，房间很新，比我订的要好价格没变。说是酒店搞活动，像我们这样的商务客人都有机会享受，不错。,1
非常不错的酒店，依山傍水，里面大片森林，散散步很不错，坐在湖边也休息也是不错的选择；房间很幽静，房间的设施很好，服务员态度也很好。,1
不知怎么回事，一直想给泰安华侨大厦点评，却一直未成功。因为酒店的服务很好。前一段时间和同事一起去泰安爬泰山，晚上12点出发，前台的服务员告诉我们山上气温低，让我们多加件衣服。挺细心的。因为凌晨退房，走的急，钱包落在床下了。快到山脚时，酒店的服务人员给我们打电话，说捡到我们的钱包了。我们这才发现钱包丢了。当即回到酒店，记得那位值班人员叫苏秀，我们在此表示感谢。谢谢！宾馆反馈2008年6月1日：我们酒店是老牌四星级酒店，员工素质高，个个都有十几年的服务经验，对客服务在泰城数首屈一值，宾客选择我们酒店会住得温馨、安心、放心的。,1
我是1月6日入住华侨大厦的，来时在车上受了点风寒，入住登记时，不住的打喷嚏，总台服务员立刻关切的询问我是否感冒了？最让我感动的是，刚进房间，客房服务员竟然送来了一碗热腾腾的红糖姜水，这种人性化的服务真的让人感到温暖。不愧为泰安市唯一一家四星级酒店，从酒店到岱庙步行只有五分钟的距离，还有金钥匙服务中心赠送的市区图和泰山地图。酒店的服务，先于客人开口之前。酒店金钥匙为我们租车、订票，在回到家的第二天，我们还意外的收到了他们的问候的短信，到现在我们还是非常高兴选择了泰山华侨大厦。而且我们还约定，08年的春天带着朋友重游泰山。,1
不错的酒店!房间较大并舒适!因为是住21层很安静!1楼餐厅菜肴价廉物美就是品种很少!是桐乡很好的酒店!,1
设施陈旧，看上去不干净。在携程订的酒店中，这间的感觉最不好。,0
房间小，地点差，交通不便，最可恶的是变相恶意宰客。建议到连云港千万不要入住该处。否则后果很严重。,0
我住的是大床间，房子不算干净，卫生间比较简陋，早餐品种太少，饭店上菜太慢，卫生也是问题，不停有苍蝇转来转去。下次不会再住了。,0
初五住的，这么冷的天没有暖气，没有热水。携程预定前台说没有收到。总之感觉很业余。,0
9月20日入住。总的来说：失望！开始拿到的房间，房间内充满很强烈的烟味，实在忍受不住，要求换房，不知是否前台有意见，给换了一间比前一间小的多的房，算了，将就一下睡一个晚上吧，心想。但一躺到床上发现不对劲，床垫中间是凹下去的，没办法躺的舒服，又不敢再叫换房了，不知再会出现什么问题。只好整个晚上睡在床垫的边上（那里没有凹），但整天晚上提心吊胆的怕掉下床！郁闷！,0
交通不方便不是自己车的话，很不方便的。尤其是在早上叫车他们没有时间观念！客房服务员爱骗人！前台的还可以！房间里有蚂蚁和不名小虫！我以后绝对不会在住那里了！同样的钱我宁愿去开元的！总体来说就可以用一个字概括就是“差”,0
1.房间内见缝插针几乎放满了各种各样的收费小商品，从茶叶到泡泡浴到塑料套2.床铺很舒服，但我的房间（809）不干净，晚上做了很可怕的恶梦3.卫生间浴缸四周填满了黑色污垢，亟待改进4.大堂宽敞高雅，前台有宽敞的椅子坐，所以可以半躺在椅子上办入住和退房手续，其它酒店是很少见的,0
"房间可以,特别的套房,非常不错,就是餐厅太脏了,早餐搞得没胃口,",1
服务不错，服务员态度也很友善。最赞的是房间够大。。写字台的布局很好。交通也很方便，周围也很热闹，步行10分钟到中闽百汇顶楼的大排挡吃饭，很便宜。味道也不错。唯一不足就是早餐收得有点早。,1
酒店的位置很方便，小套房的房间比较宽敞和舒适，住酒店停车过夜要收费40元。,1
就在崇圣寺后面，酒店环境不错，但硬件设施比较陈旧。地理位置离景点近，但离市区较远，希望酒店能多为客人提供交通上的便利，比如多发班车之类的。,1
房间很干净，打开窗口就能看见三塔，嘿嘿，连门票都省了。出门开车五分钟就能到沧海高尔夫，实在方便。美中不足，出门的时候朋友把手机丢在了床上（非常确定一定以及肯定），离开大理半小时想起来，连忙打电话过去，没想到手机被人挂掉了，再打就关机了。打电话到酒店，总台和服务员分别肯定地告诉我没看见，哎，只好自认倒霉喽。,1
酒店门口时条单行道，外出有些不方便！其他还行,1
"我通过携程定的豪华标间,价格4百元,以为这个价钱至少可以住到干净整洁的酒店吧,至于豪华,根本是没想过;但即使这样低的心理期待下,这酒店还是把我吓了一跳;一进房间就是一股霉味和臭味混杂的味道;等进了厕所,才知道房间的味道与之相比简直是小巫见大巫,简",0
酒店大堂像住宅公寓一楼大厅，所谓的“套房”的卧室比我住过的任何一个五星级的一间普通标房还小，两张床挨得紧得半米距离都不到，更令人气愤的是卫生间小得两个人在里面会打架！这是我住过的最垃圾的套房，竟然还卖807元一晚，真是把人民币看得太不值钱了！美国豪生集团旗下有这样一家酒店真是砸自己的招牌！请携程认真考察每一家签约协议往来客户的真实情况，不要让携程忠实客户一次次受到欺骗！补充点评2008年6月16日：一家性价比很低并让人十分失望的酒店！宾馆反馈2008年6月20日：感谢您选择入住上海绿地豪生全套房酒店，并给予我们忠恳的建议。首先，请允许我们为您简单介绍一下我们的酒店概况。我们属于一家国际性连锁酒店集团，提供高优质标准的酒店式服务，迎合不同种类客户的需求，希望给为您及其他客人带来回家的感觉。我们的客房最小面积为65平方米，最大至100平方米不等，每间套房均配备简洁齐全的现代化厨房设备。酒店提供餐饮、商务中心、酒吧、健身等一系列设施。此次您所入住的行政套房其面积为75平方米，每晚807元的房价，我店客房其设计风格和建筑布局比例以客厅为主，在同区域五星级酒店中具有较高的性价比，如客户想追求更加豪华、舒适的套房，也可选择我们的贵宾套房，其房型为85平方米。其次，我们酒店与携程旅行网是合作伙伴关系，我们总是以最优惠的价格，最好的房型提供给携程的客户们，以保持长期、友好的合作关系。相信携程旅行网也秉承同样的宗旨，认真负责地将每一家签约酒店推荐给忠实的客户。最后，再次感谢您的忠实建议，希望下次能有机会为您提供更优质的服务。谢谢！,0
"ctrip标上四星,但只能用金玉其外败絮其内来来形容,这件酒店外表好看而已,内部最多和如家或者7天这些廉价酒店打平手,我住过所有星级的酒店,就是这间最不符合4星的标准,如果以北京的北方佳苑和广州的华夏酒店为标准4星参考,他在我眼里和街边的小酒店没差别,我真的不知道他的四星从哪里来,前台态度差劲,连最基本的笑脸迎人都没有,酒店3楼的餐厅更是差极了,而菜单里没几样菜有的,摆明砍客,还摆出要嘛被砍,要嘛就别来吃的样子,菜的味道更不敢恭维,我第一次入住酒店后马上再出去找酒店的,紫光的位置也不太好,连沙滩都不能直接进去,建议去阳江的住南方假日酒店,服务态度好多了,而且前面就可以直接到沙滩,靠山面海,真正的海景房!或者就是住我第二天入住的小港湾山庄,这是在悬崖边的,晚上可以在小亭子听海喝喝茶也不错,离酒店不远就有一间旺角海鲜大排档,除了海虾,其他的都比外面便宜太多了,鱼虾蟹随便叫!这两间都是真正的海景房,标三星也非常符合,重点是这两三星都比4四星好太多了,所以建议大家千万不要入住所谓的阳江最好最高级的4星紫江,花钱买罪受!",0
住这里很多次了。但是感觉酒店的服务质量在下降，价格反而是不断上升。我住的房间的楼下正在装修，味道很大，打电话给前台，前台居然说没有房间，要我忍耐一下。找了前台经理理论才解决的。,0
两间房只给两条毛巾，加一条毛巾要收费5元，太过份了吧？？？,0
该酒店实际是兰州铁路局的内部招待所，位于火车站出站口处，如果不怕火车吵，那么晚上可以睡得着。价格不算便宜，只能是一般。房间很旧，房内设备一般，卫生排气扇坏了，抽水马桶也坏了，维修人员脾气很暴，要很有礼貌的对待。前台服务人员素质比较差，早上退房时前台竟然找不到服务员，等了近半个小时，耽误宝贵的时间。入住酒店停车竟然要收费。建议不要将该酒店做为入住选择，除非你对火车有特殊的感情。,0
前台小姐的态度不好，房间一开门走进去，一股发霉的味道，而且阳台的门的玻璃是坏的，cheakout的时候前台还让我们赔钱，说我们把门弄坏了。前台小姐兴冲冲的跑上来说隔壁的客人投诉我们太吵，要我们做房客登记，态度差的一塌糊涂，隔壁是客人，难道我们不是客人吗？而且我们一开门，隔壁比我们吵多了。反正就是一个字：差！,0
本人一家大小是6月7日入住、8日Out，对淋浴间很不满意全玻璃、人在里面所做的动作清楚看到，洗完澡还要走出外面洗手台穿衣服，小孩已十多岁很尴尬，座厕位置狭小无比，最让人气愤一间标榜五星级的酒店，五星级的收费但所配置的产品品牌远远达不到标准（指的是洁具、龙头、五金）。特别提醒靠停车场那边房间的住客，去厕所记得拉好窗帘，别以为那是反光玻璃来的，你们在里面的美态真让人心跳！！！,0
在九江算是难得规模大点的酒店。国庆入住的，很是糟糕。早晨回房间时2个服务员在房间，其中一个在用厕所！见进人赶紧锁门，敲门让其出来，不理，出来时在冲马桶。投诉后，高个、瘦长脸姓吴的领班说担保他们的服务员不会用客房马桶。问他凭什么担保？答不出来。又说服务员是在用厕所电话打回家，我说早晨用厕所的电话是坏的，领班赶紧说服务员其实是用自己的手机。狡辩，恶劣之极！最后问我想怎么办。我说是你在解决问题，你怎么问我？你们酒店连起码的态度都没有！最后我告诉他，挂牌四星级的酒店服务员清理客房时不许关门，服务员用客人的马桶如何保证是消毒、卫生的？不想耽误当天行程，退房走人。房间的硬件只能说是模仿四星级酒店是设施，装修用的材质很差，从没见过挂牌4星酒店用这种廉价材料，去住了就知道了。,0
"非常糟糕的服务态度,隔音非常差即使是在高层夜晚有火车声第二天搬到远洲国际",0
"酒店房间甲醛含量过高,严重影响客人身体健康.我入住的是932,刚开门差点被熏倒.第二天回来开门再次被雷到.换房626,情况稍好,但床单上有三处污点,退房时有和总台反应,好象没什么反应.吃早饭,你吃东西的速度要赶上服务员撤盘子的速度,否则桌子上会什么都不会留下.补充点评2008年7月6日：哈,刚住完,酒店价格就从450降到418,下次和携程""砍价了""",0
"入住时酒店的服务很好，大堂和房间一般，入住后发现房间的硬件较差，比如空调，马桶，尤其是电视遥控器非常差，几乎不能用。房间空调不管用，走廊也有味道。早餐很差，刚到九点服务员就疯狂地收东西，也不问一问客人是否还需要，很差，曾经看到的评价不太确切，第二天立刻搬到龙城，山西真的是没有什么好的宾馆,不知道为什么，很奇怪！",0
来到拉萨才发觉这家饭店的价格的确是偏高，同样水准的饭店在北京路上都只需200元以下。最大的问题是环境杂吵，睡不好。,0
入住的时候我强调不要靠窗的房间，结果晚上休息的时候发现自己根本就是住在马路上。凌晨一点睡下，窗户外传来嘹亮的汽车喇叭声，而且连绵不绝，拉萨的司机在一点多也频繁按喇叭；在床上还可以听到大街上人高声说话的声音、楼下店铺关门的声音。天哪，噩梦啊！马上要求换房间，答应的比较快，原来还有其他的房间空着！他们把条件好的房间空着，却把客人安排在靠近马路的房间！实在可恶,0
该酒店蛮有经济头脑滴，接机这一窝心服务让人毫不设防地扎进租车旅游队伍中。后来的各位驴友可要吸取经验，该杀价时就杀价，决不能心软，否则将来就换您心疼银子啦！,0
房间稍小，但清洁，非常实惠。不足之处是：双人房的洗澡用品只有一套.宾馆反馈2008年8月5日：尊敬的宾客：您好！感谢您选择入住金陵溧阳宾馆！对于酒店双人房内的洗漱用品只有一套的问题，我们已经召集酒店相关部门对此问题进行了研究和整改。努力将我们的管理与服务工作做到位，进一步关注宾客，关注细节！再次向您表示我们最衷心的感谢！期待您能再次来溧阳并入住金陵溧阳宾馆！让我们有给您提供更加优质服务的机会！顺祝您工作顺利！身体健康！金陵溧阳宾馆客务关系主任,1
3人间还是比较大的，就是暖气不是太暖和，时冷时热。被单会有油污的地方，不过还可以接受。洗漱间和厕所没有暖气洗澡刚开始会较冷。24小时热水、比较周到的服务、桶式饮用水还是不错的。周围环境还可以比较安静，西到西直门、动物园；北到积水潭、新街口豁口；南到西单；东到后海还是比较方便的地理位置。豁口新开的新华百货商场比较气派，还不错可以逛逛。推荐居住！,1
该酒店对去溧阳公务或旅游的人都很适合，自助早餐很丰富，酒店内部环境和服务很好。唯一的不足是酒店大门口在晚上时太乱，各种车辆和人在门口挤成一团。补充点评2008年5月9日：房间淋浴水压不稳，一会热、一会冷，很不好调整。宾馆反馈2008年5月13日：非常感谢您选择入住金陵溧阳宾馆。您给予我们的肯定与赞赏让我们倍受鼓舞，也使我们更加自信地去做好每一天的服务工作。正是有许多像您一样的宾客给予我们不断的鼓励和赞赏，酒店的服务品质才能得以不断提升。对于酒店大门口的秩序和房间淋浴水的问题我们已做出了相应的措施。再次向您表示我们最衷心的感谢！我们期待您的再次光临！,1
我们住的是8号五星楼，总体来讲还可以，服务还有些欠缺，退房是时间太长宾馆反馈2008年5月6日：非常感谢您入住金陵溧阳宾馆，并通过网站将您的入住感受与我们分享。我们宾馆始终致力于不断提升酒店的软件和硬件设备，为客人提供良好的入住环境和美好的入住体验，您的意见我们已做过专题讨论会，对于退房等一系列服务已做出改进。恭候您的再次光临！,1
我预定了大床间，可是所谓的大床只有1.5米宽，房间倒是很大。值得推荐的是自助餐，酒店客人50元/人，还是不错的。但餐厅服务员难得见到笑容，而且不太理睬客人的招呼，不好。,1
帮JJ定的好像不怎么样哦水好像差点意思补充点评2008年3月29日：我点了3分怎么还是显示4分啊,1
在桐乡是不错的选择，大堂很大。打车方便。,1
性价比较高，硬件设施比过去更加改善。满意！,1
我住的是豪华大床房，硬件不错，可惜床单上有细小毛发，不过服务台获知后马上就换了。自助餐很好。这是桐乡最好的酒店了。,1
"性价比很高的一家~也是我目前最满意的一家.门口就有便利,水果店,离久光百货5分钟步行,离2号线静安寺5分钟步行.酒店服务很到位!表扬~房间叫餐好方便,味道足,量足,价格平民~以后我会一直选择这里的.呵呵,大家记得早点预定哦!",1
"商务标间房间比较大,但洗手间很小.隔音效果也不太好.总体说来还算干净,整洁.交通很方便,离静安寺很近.",1
房间太小了，而且我自己用格林豪泰的会员卡定的房间比携程定的房间好，他是五楼的最后一间房，好像是522吧，房间很大，而且床也超大的，比1米8的大多了，希望携程以后可以提供这样的房间,1
位置：闹中取静，交通便利。门前有小型超市，东西一应俱全。老鸭粉丝小吃，酒店餐厅伙食也不错。步行离久光5分钟路程、离南京西路大型购物商场恒龙广场、梅龙镇、中信泰富20分钟，与淮海路平行，上街购物超级棒！房间：我住豪华双人间，环境不错，干净卫生，24小时热水，冷暖空调都有，还有杂志供阅读。唯一美中不足是电视有些小。服务态度也不错能及时反馈客人要求。下次去还会住。,1
订的标准间，但免费升级为行政间，不错。酒店环境不错，服务也很好。但酒店门口的停车场竟然要收费，感觉很不好，第一次碰到这种状况，希望下次去，住店的客人能够免费，不是因为20元的原因，是因为你们是五星级酒店，自然应该有真正五星级的服务。,1
很安静，周围环境不错。交通较便捷。但周围娱乐设施，或者饮食之处不多。,1
"房间有些旧了.而且我住的房间进去后居然没有打扫出来.前台和服务员协同不好.补充点评2007年12月9日：这家酒店的服务大不如从前,设施也旧了,以后不住了.",1
"这家酒店位置,房间性价比都不错的.但不知是不是由于客人多,服务自然下降.携程的客人好象在这里不太受欢迎.每次入住,要不是订的大床间没有,要不是房间没有,要不是还没有打扫出来.而且不能积会员卡的分.前台说是上面规定的,也没有什么依据.补充点评2007年12月9日：这家酒店的服务越来越差,酒店设施也旧了,大不如从前.以后不住了.",1
"携程这次不错，订的行政房给我免费升级到了8号楼的山景房。对于酒店，总结一下：超5星的环境4星的房间3星的设施和服务酒店分栋依山而建，酒店里有专门的散步路线图，要把整个酒店的山景从容走完至少1小时，期间山水桥路，鸟叫虫鸣，空气清新，心旷神怡！8号楼是酒店最好的一栋楼了（价格最贵），进入房间，房间宽大，落地窗外就是山景翠色。但其大床一看就知不会很舒服，床很低，床垫质量不好，床上用品虽然干净但明显成色已经旧了灰扑扑的颜色，摸上去硬邦邦的，家具电器以及卫生间用品都很一般。68一位早餐品种还是比较丰富，吃饱没问题，精致美味就谈不上了。各处的服务员态度还是很好但服务意识和服务质量应提高，酒店有宽阔的停车场，不过无论住店客人均收费。宾馆反馈2008年7月10日：您好!感谢您对红珠山宾馆提出的宝贵意见,我宾馆现已经将布草全部更换,您的意见我们已经交给相关部门进行处理,我们诚恳地期待您的下次光临!",1
在呼市出差，入住金辉酒店。酒店的房间、设施等相关条件，在300元左右的房价中算不错的。服务员态度很好。估计因为是工行下属的关系吧，酒店里没有那些乱七八糟的人，也没有骚扰电话。最满意的是酒店的地理位置极佳，餐饮、购物、银行、景点全离得很近。下次来呼市还会选择这里。补充点评2008年7月14日：金辉酒店自己的自助餐是38元一位，菜品冷+热+主食大概在20种左右，感觉与38元的价格比较全理。酒店2楼餐厅也可以点菜，如果您是2位以上用餐，就选择点菜吧，菜价不算贵，菜量那是相当的大。服气了。,1
