"距离川沙公路较近,但是公交指示不对,如果是""蔡陆线""的话,会非常麻烦.建议用别的路线.房间较为简单.",1
商务大床房，房间很大，床有2M宽，整体感觉经济实惠不错!,1
早餐太差，无论去多少人，那边也不加食品的。酒店应该重视一下这个问题了。房间本身很好。,1
宾馆在小街道上，不大好找，但还好北京热心同胞很多~宾馆设施跟介绍的差不多，房间很小，确实挺小，但加上低价位因素，还是无超所值的；环境不错，就在小胡同内，安静整洁，暖气好足-_-||。。。呵还有一大优势就是从宾馆出发，步行不到十分钟就可以到梅兰芳故居等等，京味小胡同，北海距离好近呢。总之，不错。推荐给节约消费的自助游朋友~比较划算，附近特色小吃很多~,1
这个酒店，本人已经是多次预订、多次入住了。个人感觉现在是越来越差。6/17早晨3点多，还是那一班火车到的的苏州，到锦地星座时大约4点，以为还能像以前那样顺利办理入住。接待当时都趴台上死睡，叫醒他们，希望办理入住，答复是：不可以，还有2小时才6点，6点后才能办理入住。如果6点前入住，要交一天的房费。我问能不能提供一下方便，按钟点房计费或者先给我住下，将相关的手续办到6点以后（以前都这么做的），接待的很不客气，说没办法。要么等，要么走。NND，LZ火冒三丈，但也不能跟这些人计较啊。从后门（富仁坊）出去30米，到汉庭住下了，人家那服务态度让人感觉真是宾至如归啊。结算按的是一天房费。需要说明一下的是：房间、设施跟锦地星座完全是一样的。只是没有早餐，那个值班经理还给我拿了15元的用品作为补偿。而房价只是锦地星座的一半。终归到底一句话，下次是肯定不会再住锦地星座了。宾馆反馈2008年7月7日：首先对您多次入住本酒店表示忠心感谢！您提出的问题酒店领导层高度重视，并进行了整改。本酒店就您提出的入住时间问题予以以下说明：根据行业规定，本酒店针对每天06：00点以后入住的宾客只算当天房价，您前两次来本店的入住的时间是：06：06分（06年8月24日），05：59分（08年5月22日），当时总台服务员给予变通解决，而您6月17日凌晨是03：45分抵达本酒店，离规定6；00点相差时间较长，当时总台服务员给您作出了充分解释。尽管如此，您的意见我们仍会虚心接受，以后针对此种情况，我们会作出变通处理。再次衷心地欢迎您下次人住本酒店。,0
赞成前面的点评，我是第一次住这边，房间设置很不合理，卫生间超级变态，不推荐入住！我出差经常住玉皇阁北街那边的玉皇阁酒店，地理位置好，是闹中取静的好地方，标间才150左右，还有游泳池，可以免费游泳，觉得性价比挺高。携程上没有，出租车司机都知道的。强烈建议携程把这家酒店也收录进去。,0
"太差,脏.差,我住过的最不好的酒店,以后决不住了",0
酒店设施老化严重。作为一家五星级酒店，居然没有无烟楼层（这是前台登记的时候酒店服务员说的）,0
"CBD中心,周围没什么店铺,说5星有点勉强.不知道为什么卫生间没有电吹风",1
总的来说，这样的酒店配这样的价格还算可以，希望他赶快装修，给我的客人留些好的印象,1
价格比比较不错的酒店。这次免费升级了，感谢前台服务员。房子还好，地毯是新的，比上次的好些。早餐的人很多要早去些。,1
不错，在同等档次酒店中应该是值得推荐的！,1
网上评价不错，但是实际情况并不尽如人意，与2-3星的水平差不多~~总的来说，性价比不高！,0
这是一家相当烂的酒店，我不知道其他人是如何评价它的，对客户那种极不信任的表情以及工作作风，自以为是，狂妄自大，肆意欺骗顾客，他们根本就没把客户放在眼里，我奉劝看过此贴的朋友，千万不要住这家黑店啊！切记！！！,0
"服务实在太差!7月9日入住的,晚上11店打1168总机拜托第二天早上645分叫醒服务,房号:2319(便于查询与确认)。竟然没有做到!!这是我这个长期出差者第一次碰到的事情,因为10日早上830分有会议才提前一天住酒店的,还好这个酒店的床板硬得不能好好入睡,才""救""了我。特此评价。",0
"整个房间也太小了点,所有的加一起大概才十平米左右!床单是脏的.",0
晚餐吃出长头发，服务员竟不以为然！洗完澡时，发现浴巾上竟也有长头发！如家在我心目中一直是快捷酒店的楷模，但这次入住北京团结湖店，令人大跌眼镜。,0
预订的房间checkin时是4楼，电话坏了几天还安排我住，到了晚上十一点发现了，前台回复说明天再给我换。我只住一晚啊，老大。在我坚持下，换了个一楼的房间，外面是停车场，一晚上完全睡不着。,0
入住丽晶，感觉很好。因为是新酒店，的确有淡淡的油漆味，房间内较新。房间大小合适，卫生间设备齐全，服务态度也很好。网速可能是提升了吧，感觉还好。有免费的插线板、水果刀。。。等一系列的日常用品免费提供，很细心。晚上的自助餐是每人68元，菜品一般、就算说的过去吧。酒店外有西贝筱面等几家饭馆。西贝的菜实在是量大的惊人，人多在酒店吃就不如去西贝吃了。酒店21：30-24点有广式晚茶，吃过几次，味道正宗，就是点心品种略少。哈。酒店地处青山区，包头分昆区、青山区。相对来说：昆区是最繁华的，青山区次之。像包百等大商场全在昆区，从酒店打车到包百商圈车费12元多。青山区也有一个王府井百货，相对来说比包百商圈的略小，从酒店打车8元多。银河广场离酒店有一段距离，打车9、10元吧，银河广场边上有“科丽珑”24小时营业的超市。酒店一楼有小卖部，周围基本没有超市。这次住正赶上有几家公司在这里开会，有时楼道里略吵，晚上还有几次有人敲错门，理论上与酒店管理没关系吧。希望以后还是尽量让会议团体住在一层，也许这样可以好些吧。总体感觉丽晶很好，以后来包头还会住这里。,1
1。酒店比较新，装潢和设施还不错，只是房间有些油漆味。2。早餐还可以，只是品种不是很多。3。交通比较方便，周围的小饭店比较多。,1
我住的是特色标间，所谓特色，是有些类似家的感觉。寝具不是单调的白色，是条纹和大格子的，感觉很温馨。圈儿椅的靠垫是卡通的加菲猫头，明黄的颜色有点扎眼，和周围配在一起感觉有点不协调。客房硬件评价3.5分。加湿器、烫衣板、电熨斗、吹风机、小冰箱等俱全。缺点：液晶电视固定在墙上，位置不好。一是遮挡了一个电源插座；二是与桌子搭配不当。桌子（与冰箱柜一体）在电视下方，如果坐在桌子旁上网或工作学习，正好挡住了电视屏幕。错开坐，正好是冰箱柜，腿脚伸不开。,1
早餐很丰富，服务也热情，早上很早退房时，前台值此人员办理手续也非常快．,1
这次是308的行政大床，总体感觉非常不错，就是价格稍许高了点，旁边有个五星的豪华客房才398。估计小天鹅也只有这个房型以上的，看得过去，以前住过的房间实在是很差。以后大家如果要住这里，还是选这个行政大床吧！,1
好像跟洪崖洞酒店一个公司的，所以房间的风格比较接近，就是小一些，整体来说比较不错，房间内食品都是免费，很实在。就是早餐实在不敢恭维，大堂环境比较差。整体来说不错，属于比较好的三星级酒店。,1
前台楼层服务员都不错，房间安静整洁，交通方便，吃的周围也挺多．唯一不足，卫生间地漏设计不好，导致少量积水．,1
这个宾馆总体感觉还不错，无论从价格、出行、购物，还是订机票（国航就在它的右边）都很方便。只是房间没有什么电脑，也不知道它说的免费上网在什么地方可以。补充点评2007年10月12日：对了，去机场也很方便，机场大巴就在它下面，每半个小时一趟,1
"价格偏高,服务一般.窗外风景ok.早餐还不错",1
酒店正在申定五星中，不过目前看来四星都有点勉强。大堂很气派，不过细节很粗糙。硬件需要加强。服务人员礼貌热情。酒店的房间和早餐都还不错。,1
闹中取静的一个地方，在窗前能看到不错的风景。酒店价格的确有些偏高,1
总台服务还可以，房间实在不怎么样，空调很吵，床居然是一边高一边低的，这个房价实在是不值得，下次不会选择。,0
5月1日入住，其他地方没房间，定了锦地星座的特惠标准间，checkin的时候被告知升级到高级标准间，心里一阵暗喜，没想到经过一段乱糟糟的路（好像是厨房的外面）后，到了1号楼，进了房间更加失望，床小不说，还什么都没有，设施陈旧，马路上汽车的噪音更是让人难以忍受，洗个澡水流一地，哎，下次还不如去住个连锁商务酒店，同等的条件价钱最多只有2/3。,0
"设施虽稍陈旧一些,但良好的服务给人温暖.酒店所处地理位置和环境极好.对年龄较大的个人旅游者而言,入住该酒店不失为较佳选择.",1
房间比较干净，卫生间太小，转身都费劲。地理位置一半，因在胡同里，不容易找到。服务一般。,1
总体很满意，但有一点需改进，我在9楼入住，走时到1楼前台结帐时由9楼层服务员检查房间，发现我有零星物品遗失在房间，我当时请他们送下来，结果答复是到4楼客房服务部去取，我到了4楼，又说服员员没时间，又要到9楼去取。当然这没什么，但是如果他们给东西送下来，哪怕是到4楼就取到了东西，我会对酒店有更好的印象。,1
环境不错，室内色调很温馨，MM很满意！就是窗户收拾得太马虎了，拉开窗帘就觉得很凌乱的感觉。最不足的地方就是淋浴了，一是地方太小了，二是洗澡时水时大时小的，中间还停了几秒！！,1
4年前住过。酒店设施这个价格还算值，尤其是黄金周期间。临海位置很好。高层，大部分房间都可以看到海。前台接待的小姐态度很生硬，登记的姓名没一个字是对的。算啦，不影响住也就不计较了。,1
西餐厅的晚餐不错，68的自助餐，吃得捧着肚子出门。一个字，棒！早餐就差远啦！还敢号称68，一个字，汗！宾馆反馈2008年8月14日：尊敬的宾客：您好！感谢您入住金陵溧阳宾馆！并给我们留下宝贵的意见！对于早餐的问题我们将做及时的调整。我们一定会继续努力与进取，发扬金陵溧阳宾馆“以客为尊”的服务理念，让每一位宾客都能对金陵溧阳宾馆留下美好而深刻的印象。再次向您表示感谢！期待您的再次光临！祝您工作顺利！身体健康！金陵溧阳宾馆客务关系主任,1
早餐很不错，离市中心比较近，购物方便，但是5号楼的房间相当于3星标准。不过相对于房价也值了补充点评2008年8月11日：另外，房间提供的拖鞋太小了，根本穿不下，难道是给女士设计的？我是42码的脚啊。宾馆反馈2008年8月14日：尊敬的宾客：您好！感谢您入住金陵溧阳宾馆！并及时把您的感受和意见告知我们！对于你提出的拖鞋太小的问题。等您下次入住金陵溧阳宾馆时只需向我们的服务员提出。我们将根据您的意见记录特别需求，提供您满意的服务！，发扬金陵溧阳宾馆“以客为尊”的服务理念，让每一位宾客都能对金陵溧阳宾馆留下美好而深刻的印象。再次向您表示感谢！期待您的再次光临！祝您工作顺利！身体健康！金陵溧阳宾馆客务关系主任,1
订的2个房间由于一间空调是坏的，还生了霉，问服务员说没有其他房间了，让我们去退房。于是到了前台退房。第二天携程客服电话说我们订2间只住了一间，要扣掉另一间的钱(用信用卡担保过)。我说是房间的问题才退的，去找酒店负责人理论，负责人说我不管，你们只住了一间，不管退的那间。我说是服务员让我退的，他说服务员说的话无效。那个态度。。。于是，，，后面多少波折，，，，哎，差点误了回北京的车还好携程大度，调查清楚后免扣了多一间房间的钱,0
6月26日予定7月2日入住的房间1、6月27日得到确认。2、7月2日早上来电说给我们房间升级。3、办理入住，却把我们放到了离开海边很远的天津工人疗养院，曰：有会议，没有房间，周围事工地、房间霉味严重、离海500米。原来这就是升级！3、很官僚的机关作风。以上就是经历。,0
离海边很近，但是房间的装修已经不是很新（海景房，1号楼），老式的宾馆，老式的服务。适合要求方便，但对房间设施不挑剔，要求不是太高的朋友补充点评2006年9月3日：比较过分的是所谓“海景房”（还要多加90元的）外面竟然首先是个堆放垃圾桶、扫把、拖把和打扫卫生者晾晒裤子的晒台，之后是个树林，再远处才是海，不知道这样的房间叫“海景房”合适不合适？；房间内霉味较重，打开窗户跑味半天时间也用处不大，个别墙壁角落处有霉点；床单、被褥的洁净程度很一般，比小旅馆还是要强，床看起来不是很平，但是睡着还凑活；枕套两套，上面的还算白（但是有洗不掉的污迹），下面稍灰；刚进入房间后不满霉味和所谓“海景”提出换房，当值的中年男人推诿多次无果，答应有退房的换，后来竟然告知一天都没有人退房。管理水平很一般，当然是和类似的小地方比，办手续的速度很慢，前台电脑里没有管理系统，竟然用的是word，好歹用个excel吧！这种管理落后的宾馆建议ctrip除名，要不以后怎么让人相信你们？,0
由于房间里面的水是锈水，大堂副理免费升级到套间，由于我预定3天，讲好头2晚是478，第三晚是578。结果第三天直接告诉只能是678，经过与携程反映也没有效果，原因就是第三天有一批人来此开会，房间不够，故意把住客赶走。坚决再也不住这里了。态度十分差劲。,0
酒店不像是五星的，最多三星标准，比较失望，两个房间的海景只能看到一个角，而且服务意识都没有，我们两个房间都忘了东西，结果都到蓬莱了还没人联系我们。打电话想让他们寄回来，结果都在踢皮球，闹了半天还得回去拿。郁闷~~,0
某些酒店人员对待顾客不诚恳。说给你换房间，骗你说是价钱贵的房间。其实是把你的房间档次调低了。没有房间就实话实说，别骗人啊，什么态度。有些房间的隐私性也不好,0
"首先感觉不像大酒店,应该属于公寓式酒店,房间很小,明显是住宅公寓改装的.其次门童的服务不好,傻站在那里,我进去朝我傻傻的看着,既不问好,也不微笑,还不如放个像机场一样的假人算了,第一印象差.当然前台的服务也很一般,说是从什么日记本,但不是我主动打电话讨要的话根本没人送来.如果说300多块的房价我就不说什么了,但600的房价确实让我感觉太不值了.补充点评2008年1月16日：补充一点:附件的交通也不方便,说道这里我要批评携程,描述这个酒店在八佰伴附近,去查查词典看看什么叫""附近""宾馆反馈2008年1月18日：感谢您对酒店提出的善意的批评。酒店对相关部门的经理及员工进行了批评与处理，并从工作流程上进行了重新调整，尽量杜绝漏发礼品情况的发生。真心地希望客人能再次入住，对酒店的服务进行监督，以便酒店的服务能更趋完善。",0
刚回成都没有地方住，就只有在等朋友最近的地方定了紫薇。去之前很担心，因为该酒店的评价一直不是很好。到了大堂果然失望，服务人员就像刚从周围打工市场招来的，连衣服都不怎么干净！态度还很冷淡！房间里面最大的缺点就是设计问题。阳台的玻璃门打不开，整个房间没有办法透气，很闷！！不过早餐还将就，服务还可以，才算得上四星级的酒店，其他的，真的很让人失望，大家最好还是不要去的好！！,0
我感觉不行。。。性价比很差。不知道是银川都这样还是怎么的！,0
房间隔音效果极差，深夜如果隔壁客人大声喧哗的话……服务员会去提醒，但仅限于你投诉后,0
"价格偏高,好象连云港这地方的酒店都偏贵.早饭不好.房间还不错,窗外风景还行.最重要是房间的窗户很隔音.床小,还是明珠万豪的床好些.",1
知道网线接口在哪儿吗？比高家庄的地道口还隐蔽。在床头柜后面！想不道吧？看你怎么用。1：自带4米以上网线；2：自带小板凳：3：房间的垃圾桶可翻过来坐......,1
沈阳市政府的酒店，比较大气，交通便利，出门往左就是北陵公园，环境好。,1
"政府酒店感觉很气派,而且很干净,整个酒店的房间布局也很整齐.5月份入住的,由于第一天房间不能上网,和前台协调又换了一间可以上网的,还帮忙调试了笔记本,服务很周到.正好住的两天都有人结婚,感觉酒店一楼的宴会厅很适合婚礼",1
"总体还可以,就是前台服务员还不够敬业,在登记入住后,看都没看是不是本人,就把我客人的护照给了其它人,幸亏就在旁边,要不然不知后果怎样,之后连说声不好意思,或对不起都没有!!!希望改进!!!",1
6月下旬去丹东，在携程网上预定了丹东国际酒店2天的住宿。24日傍晚抵丹东，便打车去酒店。丹东城市不大，一说国际酒店，司机都知道。酒店在一条不起眼的小街上，周围环境一般。到总台一问，接待员说没有收到携程的预定单。我给他们看了手机收到的携程确认短信，接待员说那好吧，就按携程预定价住下吧。我说，能不能给个朝鸭绿江的房间，接待查了一下电脑，说可以，不过房间小了点，我说没关系，反正一个人住。安排的是15层（接待员还真满足了客人看江的要求），进了房间，往窗外一看，蜿蜒的鸭绿江就在眼前，朝鲜一侧的房屋和农田也清晰可见，稍远处隐约可见鸭绿江桥！房间略显旧了些，但床、被还较整洁、干净。这江景房的性价比应该是超值的！想当年国际酒店在丹东大概是数一数二的，现在来看，装修上比不上新开业的，大堂不太光亮，楼层的电梯口也只开了一小部分灯光，但服务上还不错。服务员遇到客人都会问好。特别值得一提的是23楼的旋转餐厅，可以与深圳国贸和上海新锦江顶楼的旋转餐厅相比拼！毕竟是在丹东那么一个边境小城里。20元的自助早餐较丰盛，再加上可以面对鸭绿江，饱览异国风光（尽管是农田沙洲景色）。在丹东国际酒店2天的停留还是给我留下来不错的印象。,1
这次去北京，是要去北师大办事，所以特意留意了下附近的宾馆。住了两天，首先该宾馆很好找，离西四大街很近，公交车护国寺站下步行两分钟就到。因离公交站近，去哪坐公交都方便，很省钱省事。宾馆外有很多小吃店，价位比王府井小吃街要便宜，护国寺街上报刊厅、2毛一分钟的公用长途电话、水果摊、24小时便利店、网吧应有尽有，很方便。房间很干净，在这方面，在北京住过的几个三星级的还不如这家二星级的。房间暖气也开得足够，缺点就是冲澡时水温太低，而且忽冷忽热，不知道是什么原因。卫生间的插座不能充电，窗头柜下没插座，所以只能在电视机柜后充电，不太方便。另宾馆对面的烟酒店里的烟不能买，多是假的。宾馆服务员都很热情，让人感觉很好。推荐一个！,1
"房间设备太破,连喷头都是不好用,空调几乎感觉不到,虽然我开了最大另外就是设备维修不及时,洗澡用品感觉都是廉价货,味道很奇怪的洗头液等等...总体感觉服务还可以,设备招待所水平...",1
总体感觉不错，美中不足的是房与房之间隔音效果不太好，还有房价感觉稍高。,1
"房间太脏,竟然没有热水,本楼服务员说锅炉坏了修理不了,.我要求换房间,既然回答说全部三个楼都没有热水,明显骗人!还说没有空房间了.我说那我搬走不住了,明确告诉那两个自作聪",0
这个酒店很一般！甚至说不好！就有一点离“红门”很近，徒步爬泰山比较方便，但做车上泰山不方便，服务有好有坏，第一天凌晨到宾馆寄存东西，我跑了三趟拿东西，打搅服务员三次睡觉，但并没有不悦的表情，感觉很好！但晚上住在宾馆我提出用一下公用电脑到些照片，另外一个服务员，用话搪塞我！有点不高兴！其他宾馆都有公用电脑满足来宾的上网或倒照片的需要，他们却搪塞！很失望！还有宾馆的被子感觉不是很干净，还摆了些乱七八糟的东西（都是收费的），还有避孕套和男女洗液，很是搞笑！（当然这些都收费）！害的我牙刷都没敢用他们的，不是怕付钱而是怕脏！o(∩_∩)o...不过话说回来携程在泰安找的宾馆都不怎么样！,0
服务态度不好，极差，前台态度恶劣，房间卫生不干净，诬陷客人照成，要求客人赔偿,0
"我在晚上6点30左右入住的,当时是一位男服务员为我登记,我问他可不可以作信用卡预授权，他说不可以但建议我可以用现金作为押金到退房时可以用信用卡消费．房间很大但很旧，电视机只能收到４个台的节目，在第三天我退房时要求用信用卡消费，当时一位女服务员说我之前是用现金作为押金是不可以再用信用卡消费的，还反问我说如果我要消费的话在入住时为什么不做预授权，当时我就把之前那位男服务员说的话跟他说一次后又反口说是因为现在机器坏了不能用，我跟她说我在３０分钟之前见到有一位客人才用信用卡消费过，为什么会这么快就坏了，她见我态度那么强硬就帮我用卡消费了，事实上证明了刷卡机并没有坏，当时因为我们赶着到机场坐飞机就没有再跟她理论了，但一直觉得心中有气．",0
在老火车站旁，环境不好。感觉房间也不怎么干净，房间里东西也贵。,0
"位置不错,在市中心.周围吃饭等很方便.房间一如既往的干净",1
房间还可以，楼下有食街，服务态度很好！不过网络不太好，总是断线；早餐一般般。,1
不错的酒店，房间干净，安静（15楼）。客户请客就在酒店的包房吃的，味道很好。中式早餐略有不足，没什么可选，味道还可以。,1
酒店的设施稍微老了一点，是四星级酒店的一个附楼。但是服务不错，而且酒店的价格非常吸引人。下次还会入住的！补充点评2008年2月22日：我住的是150的。还不错，冬季里没用霉味！,1
"住的是350的大床房,以四星标准衡量的话,家具太旧,房间太小,早餐品种单一,别的总体来说还可以吧,地段不错,服务也满好.",1
去住的话最好是住朝向大院的房间，因为酒店后面有中央空调的一些设备，晚上响起来的话影响休息的。早餐很一般，没甚么好吃的东西。酒店旁边有条小路，那里有几家实惠的小饭店，比如私家菜甚么的。总的来说，出差宜兴，国际饭店还是第一选择。,1
服务很热情，交通也很便利，下次如果去北京我还会选择这家酒店!,1
入住的时候，恰逢前台的POS机坏了，只能预付现金，有些不便。不过位于一楼的餐厅真是物美价廉，值得一去。,1
房间很清洁，洗手间装修好。早餐非常丰盛，豆腐脑很好吃！交通很方便。隔音不够好，我们的邻居夜里1点多电视声音开的很大，投诉后酒店服务人员去与隔壁邻居协商解决了。,1
"硬件很好,服务质量也很好,特别是酒店周围环境非常优雅.早餐也不错,下次去还会入住",1
"虽然表面看很一般,但里面装修还是很精致的,住着干净,舒服;以后去宜兴首选还是宜兴宾馆!",1
整个酒店的环境、设施等都很不错，但让服务员拿份地图，却一直没拿来，价格好象比以前也高了一点。不过性价比还是令人满意的。,1
自助早餐非常好，服务很周到，下次还会去住。,1
前台小姑娘很有意思，经常入住，都熟了，呵呵,1
相当于五星的服务，好于四星的早餐，差不多三星的房价就是要借东西补充点评2008年5月12日：有个印度啊三，很有派头，服务热情,1
